company,position,city,review_date,experience,rating_total,pros_text,cons_text,full_text,sentiment_label,source_url
Т-Банк,Территориальный представитель,Рязань,апрель 2026,Работал 3-5 лет,5.0,"Это было намного интереснее, чем сидеть в офисе. Постоянно каскад новых лиц, пробуешь разные подходы, изучаешь новое. Скучать было некогда. С коллективом выстроила прекрасные отношения, причем это касалось не только работы. Периодически встречались в городе, кайфовый период моей жизни.",Не хватало организованной от банка активности для сотрудников. Корпоративы были бы совсем не лишними. Ответ представителя компании Май 2026,"Это было намного интереснее, чем сидеть в офисе. Постоянно каскад новых лиц, пробуешь разные подходы, изучаешь новое. Скучать было некогда. С коллективом выстроила прекрасные отношения, причем это касалось не только работы. Периодически встречались в городе, кайфовый период моей жизни. Не хватало организованной от банка активности для сотрудников. Корпоративы были бы совсем не лишними. Ответ представителя компании Май 2026",positive,https://dreamjob.ru/employers/25607?page=5
Т-Банк,Представитель банка,Брянск,апрель 2026,Работал 1-2 года,4.0,"Работать можно, только придется основательно обрастать знаниями и не бояться людей. Мне было несложно, так как сам по себе коммуникабельный и новую информацию впитываю как губка, а обучение тут организовано на 10 из 10. Самое главное для хорошего заработка - продажи. Я в этом настолько преуспел, что за 2 года пришел к решению запустить собственный бизнес.","Встречи в течение дня достаточно плотно назначаются, а так как их не меньше 15 обычно, сильно уставал. Перерывы между ними конечно были, не голодный бегал по клиентам, но все же нагрузка ощутимая. Ответ представителя компании Май 2026","Работать можно, только придется основательно обрастать знаниями и не бояться людей. Мне было несложно, так как сам по себе коммуникабельный и новую информацию впитываю как губка, а обучение тут организовано на 10 из 10. Самое главное для хорошего заработка - продажи. Я в этом настолько преуспел, что за 2 года пришел к решению запустить собственный бизнес. Встречи в течение дня достаточно плотно назначаются, а так как их не меньше 15 обычно, сильно уставал. Перерывы между ними конечно были, не голодный бегал по клиентам, но все же нагрузка ощутимая. Ответ представителя компании Май 2026",positive,https://dreamjob.ru/employers/25607?page=5
Т-Банк,Представитель банка,Тольятти,апрель 2026,Работаю 3-5 лет,5.0,"-Деньги здесь платятся хорошие, главное самому не щелкать клювом и делать свою работу максимально качественно, -Продавать научился за 2 месяца, сейчас этот навык мне здорово помогает в развитии собственного дела, -Замечательный коллектив, где тебе на каждом шагу подставляют плечо, а не подножку, -Адекватное руководство, которое не только нарезает задачи, но и слышит о проблемах, а спорных ситуациях реально разбирается, а не слепо встает на сторону клиента.","Очень советую внедрить практику компенсации расходов для представителей по угощению клиентов кофе/чаем. По своему опыту скажу, довольному клиенту намного проще продавать. Ответ представителя компании Май 2026","-Деньги здесь платятся хорошие, главное самому не щелкать клювом и делать свою работу максимально качественно, -Продавать научился за 2 месяца, сейчас этот навык мне здорово помогает в развитии собственного дела, -Замечательный коллектив, где тебе на каждом шагу подставляют плечо, а не подножку, -Адекватное руководство, которое не только нарезает задачи, но и слышит о проблемах, а спорных ситуациях реально разбирается, а не слепо встает на сторону клиента. Очень советую внедрить практику компенсации расходов для представителей по угощению клиентов кофе/чаем. По своему опыту скажу, довольному клиенту намного проще продавать. Ответ представителя компании Май 2026",positive,https://dreamjob.ru/employers/25607?page=5
Т-Банк,Специалист взыскания,Волгоград,апрель 2026,Работал 1-2 года,5.0,"Мне впервые в жизни довелось осесть на удаленке, это гораздо комфортнее, чем каждый день таскаться в офис. Без дресс-кода и ранних подъемов намного лучше себя чувствовала и работала эффективнее. На зарплату грех жаловаться, платили исключительно вовремя и хватало на хлеб с маслом. Здорово освоила навыки общения со сложными людьми, теперь умею корректно отказывать, останавливать разговор и возвращать его в нужное мне русло.","Перепады электроэнергии или нестабильный сигнал интернета - это прямо катастрофа, ведь вся работа напрямую зависела от онлайн присутствия. Ответ представителя компании Май 2026","Мне впервые в жизни довелось осесть на удаленке, это гораздо комфортнее, чем каждый день таскаться в офис. Без дресс-кода и ранних подъемов намного лучше себя чувствовала и работала эффективнее. На зарплату грех жаловаться, платили исключительно вовремя и хватало на хлеб с маслом. Здорово освоила навыки общения со сложными людьми, теперь умею корректно отказывать, останавливать разговор и возвращать его в нужное мне русло. Перепады электроэнергии или нестабильный сигнал интернета - это прямо катастрофа, ведь вся работа напрямую зависела от онлайн присутствия. Ответ представителя компании Май 2026",positive,https://dreamjob.ru/employers/25607?page=5
Т-Банк,Специалист взыскания,Краснодар,апрель 2026,Работал 1-2 года,4.0,"Я работал 2 года и с первого дня был оформлен официально по ТК. За счет этого у меня имелись все предусмотренные законом права и гарантии, но, должен признать, здесь и не обижали. Платили хорошо, не разочарован доходом, плюс был ДМС и компенсировали расходы на фитнес. Да и на сами продукты банка действовали для меня как для сотрудника льготные тарифы. С коллективом легко нашел общий язык, несмотря на удаленку, мы тогда много общались и помогали друг другу. Много с кем до сих пор поддерживаю связь.","Не все так радужно обстояло во взаимодействии с клиентами. Должники - специфическая категория и абсолютно по каждой ситуации приходилось глубоко погружаться в проблему. Потом долго отходил от негатива, не пропускать это через себя для меня было нереально. Ответ представителя компании Май 2026","Я работал 2 года и с первого дня был оформлен официально по ТК. За счет этого у меня имелись все предусмотренные законом права и гарантии, но, должен признать, здесь и не обижали. Платили хорошо, не разочарован доходом, плюс был ДМС и компенсировали расходы на фитнес. Да и на сами продукты банка действовали для меня как для сотрудника льготные тарифы. С коллективом легко нашел общий язык, несмотря на удаленку, мы тогда много общались и помогали друг другу. Много с кем до сих пор поддерживаю связь. Не все так радужно обстояло во взаимодействии с клиентами. Должники - специфическая категория и абсолютно по каждой ситуации приходилось глубоко погружаться в проблему. Потом долго отходил от негатива, не пропускать это через себя для меня было нереально. Ответ представителя компании Май 2026",positive,https://dreamjob.ru/employers/25607?page=5
Т-Банк,Главный специалист кредитного отдела,Москва,апрель 2026,Работал 5-10 лет,4.3,"Удобный График, вовремя все выплаты, бонусы+13 зарплата, ДМС, спортзал, руководство по крайней мере которое было раньше, условия работы, обучение","Выходы в бонус!!! При моей должности очень тяжело было сохранить доход, тк слишком завышены коэффициенты. Ответ представителя компании Май 2026","Удобный График, вовремя все выплаты, бонусы+13 зарплата, ДМС, спортзал, руководство по крайней мере которое было раньше, условия работы, обучение Выходы в бонус!!! При моей должности очень тяжело было сохранить доход, тк слишком завышены коэффициенты. Ответ представителя компании Май 2026",positive,https://dreamjob.ru/employers/25607?page=5
Т-Банк,Представитель банка,Краснодар,апрель 2026,Работал 3-5 лет,5.0,"Не жалею, что сразу после школы не стал поступать в универ, а на 3 года завис здесь. Я разобрался в самом себе, в людях и окружающем мире. Понял, что юриспруденция - это вообще ни разу не мое, поступил учиться на менеджера. Совмещать заочку с работой не захотел, выбрал дневную форму обучения. Накопленных здесь знаний и опыта мне хватает, чтобы сейчас гораздо лучше усваивать учебный материал и неплохо проявить себя на стажировке.","Отсутствие многих полезных бонусов, вроде ДМС, компенсации фитнеса, бесплатного питания…все это положительно сказалось бы на моей эффективности. Ответ представителя компании Май 2026","Не жалею, что сразу после школы не стал поступать в универ, а на 3 года завис здесь. Я разобрался в самом себе, в людях и окружающем мире. Понял, что юриспруденция - это вообще ни разу не мое, поступил учиться на менеджера. Совмещать заочку с работой не захотел, выбрал дневную форму обучения. Накопленных здесь знаний и опыта мне хватает, чтобы сейчас гораздо лучше усваивать учебный материал и неплохо проявить себя на стажировке. Отсутствие многих полезных бонусов, вроде ДМС, компенсации фитнеса, бесплатного питания…все это положительно сказалось бы на моей эффективности. Ответ представителя компании Май 2026",positive,https://dreamjob.ru/employers/25607?page=5
Т-Банк,Специалист контактного центра,Самара,апрель 2026,Работаю 1-2 года,5.0,"-работала удаленно, то есть без сопутствующих расходов на проезд и питание вне дома, а главное без соблюдения дресс-кода, -помимо окладной части была хорошая система мотивации, зарабатывала прилично и без напряга, -работа состояла в общении с людьми и я не преувеличу если скажу, что получала от этого удовольствие, -с коллективом повезло, никто ни разу не подставил.","-тишину во время работы не всегда просто обеспечить, -бывали перебои с интернетом. Ответ представителя компании Май 2026","-работала удаленно, то есть без сопутствующих расходов на проезд и питание вне дома, а главное без соблюдения дресс-кода, -помимо окладной части была хорошая система мотивации, зарабатывала прилично и без напряга, -работа состояла в общении с людьми и я не преувеличу если скажу, что получала от этого удовольствие, -с коллективом повезло, никто ни разу не подставил. -тишину во время работы не всегда просто обеспечить, -бывали перебои с интернетом. Ответ представителя компании Май 2026",positive,https://dreamjob.ru/employers/25607?page=5
Т-Банк,Отзыв сотрудника,Пожаловаться Работаю меньше года Москва,апрель 2026,Работаю меньше года,1.7,"Очень мало платят ,нет суммы о которой заявлена в вакансии Неудобно работать в их приложении,","Зарплата не соответствует требованиям,требования очень много а платят копейки ,на задания тратишь время а получаешь копейки ,соответственно мотивации нет на работу Ответ представителя компании Май 2026","Очень мало платят ,нет суммы о которой заявлена в вакансии Неудобно работать в их приложении, Зарплата не соответствует требованиям,требования очень много а платят копейки ,на задания тратишь время а получаешь копейки ,соответственно мотивации нет на работу Ответ представителя компании Май 2026",negative,https://dreamjob.ru/employers/25607?page=5
Т-Банк,UX/UI-дизайнер,Москва,апрель 2026,Работал 1-2 года,3.8,"Был классный офис, включено питание и хороший ДМС пакет. Неравнодушные коллеги, довольно неплохо настроенные процессы","Очень высокий темп работы, очень высокие требования, многие коллеги часто оставались после рабочего дня и перерабатывали, в том числе на выходных Ответ представителя компании Май 2026","Был классный офис, включено питание и хороший ДМС пакет. Неравнодушные коллеги, довольно неплохо настроенные процессы Очень высокий темп работы, очень высокие требования, многие коллеги часто оставались после рабочего дня и перерабатывали, в том числе на выходных Ответ представителя компании Май 2026",neutral,https://dreamjob.ru/employers/25607?page=5
Т-Банк,Оператор call-центра,Пожаловаться Работал меньше года Санкт-Петербург,апрель 2026,Работал меньше года,4.3,"Работа полностью на дому,удаленное обучение,удобное оформление,в целом сама работа неплохая","Зарплату повысить,придумать какие-то плюшки для сотрудников,больше материала для обучения Ответ представителя компании Май 2026","Работа полностью на дому,удаленное обучение,удобное оформление,в целом сама работа неплохая Зарплату повысить,придумать какие-то плюшки для сотрудников,больше материала для обучения Ответ представителя компании Май 2026",positive,https://dreamjob.ru/employers/25607?page=5
Т-Банк,Оператор,Тула,апрель 2026,Работаю 3-5 лет,5.0,,"Желаю, чтобы банк продолжал развиваться и улучшать условия труда для сотрудников, не прекращал слышать сотрудников. Можно подумать в сторону бесплатных сбалансированных ПП-обедов. Ответ представителя компании Май 2026","Желаю, чтобы банк продолжал развиваться и улучшать условия труда для сотрудников, не прекращал слышать сотрудников. Можно подумать в сторону бесплатных сбалансированных ПП-обедов. Ответ представителя компании Май 2026",positive,https://dreamjob.ru/employers/25607?page=5
Т-Банк,Территориальный представитель,Тольятти,апрель 2026,Работаю 1-2 года,5.0,"Пошел работать с представителем так как за 6 лет просиживания штанов в офисе до жути устал от документов, экселевских таблиц и отчетов, здесь у меня ничего этого нет, зато есть живое общение с людьми и возможность развиваться. Доход в целом меня устраивает, как минимум потому, что напрямую зависит от меня самого. Это тот редкий случай, когда производительность качество и количество работы определяют заработок.","Фиксированная часть дохода должна быть более существенной, не каждый месяц удается одинаково удачно продавать, хочется чтобы было больше стабильности в выплатах. Ответ представителя компании Май 2026","Пошел работать с представителем так как за 6 лет просиживания штанов в офисе до жути устал от документов, экселевских таблиц и отчетов, здесь у меня ничего этого нет, зато есть живое общение с людьми и возможность развиваться. Доход в целом меня устраивает, как минимум потому, что напрямую зависит от меня самого. Это тот редкий случай, когда производительность качество и количество работы определяют заработок. Фиксированная часть дохода должна быть более существенной, не каждый месяц удается одинаково удачно продавать, хочется чтобы было больше стабильности в выплатах. Ответ представителя компании Май 2026",positive,https://dreamjob.ru/employers/25607?page=5
