company,position,city,review_date,experience,rating_total,pros_text,cons_text,full_text,sentiment_label,source_url
Т-Банк,Специалист по документообороту,Москва,март 2026,Работаю 3-5 лет,5.0,"Мне нравилось, потому что спокойно, без давления, даже без общения с клиентами. Да и с коллегами общаться нужно было по минимуму. Чисто работа с документами в комфортном темпе.","Сложно сказать, в плане мебели только можно было бы улучшить по-моему - удобнее сделать стулья например. Ответ представителя компании Март 2026","Мне нравилось, потому что спокойно, без давления, даже без общения с клиентами. Да и с коллегами общаться нужно было по минимуму. Чисто работа с документами в комфортном темпе. Сложно сказать, в плане мебели только можно было бы улучшить по-моему - удобнее сделать стулья например. Ответ представителя компании Март 2026",positive,https://dreamjob.ru/employers/25607?page=10
Т-Банк,Персональный менеджер,Москва,март 2026,Работаю 3-5 лет,5.0,"Нравился график, сама специфика работы. Самое главное — коллектив и отношение к сотрудникам, конечно. Зарплата хорошая. Большая поддержка беременных и женщин в декрете.","Очень напрягали постоянные попытки заставить ездить в офис. К сожалению, экстраверты не понимаю, что далеко не всем это подходит и многие люди гораздо лучше делают свою работу в одиночестве, а эти поездки только демотивируют. В какой-то момент я даже была готова уволиться из-за этого, но вопрос удалось решить — мне пошли навстречу. Ответ представителя компании Март 2026","Нравился график, сама специфика работы. Самое главное — коллектив и отношение к сотрудникам, конечно. Зарплата хорошая. Большая поддержка беременных и женщин в декрете. Очень напрягали постоянные попытки заставить ездить в офис. К сожалению, экстраверты не понимаю, что далеко не всем это подходит и многие люди гораздо лучше делают свою работу в одиночестве, а эти поездки только демотивируют. В какой-то момент я даже была готова уволиться из-за этого, но вопрос удалось решить — мне пошли навстречу. Ответ представителя компании Март 2026",positive,https://dreamjob.ru/employers/25607?page=10
Т-Банк,Ведущий оператор клиентской поддержки,Москва,март 2026,Работал 5-10 лет,5.0,"Долго работала в поддержке банка. Постепенно росла в должности. Уходила с позиции ведущего оператора. Уходила по личным причинам, но совсем не потому, что меня что-то не устраивало. Скорее наоборот, в плане условий это была одна из лучших моих работ: ДМС, хорошая зарплата, официальное оформление, много бонусов, корпоративные тарифы. К тому же еще и прекрасный коллектив, мы до сих пор общаемся и дружим со многими коллегами.","Будь возможность выходить на линию по полтора-два часа в день я бы работала до сих пор. Но настолько гибкого графика на тех же условиях нет, к сожалению. Ответ представителя компании Март 2026","Долго работала в поддержке банка. Постепенно росла в должности. Уходила с позиции ведущего оператора. Уходила по личным причинам, но совсем не потому, что меня что-то не устраивало. Скорее наоборот, в плане условий это была одна из лучших моих работ: ДМС, хорошая зарплата, официальное оформление, много бонусов, корпоративные тарифы. К тому же еще и прекрасный коллектив, мы до сих пор общаемся и дружим со многими коллегами. Будь возможность выходить на линию по полтора-два часа в день я бы работала до сих пор. Но настолько гибкого графика на тех же условиях нет, к сожалению. Ответ представителя компании Март 2026",positive,https://dreamjob.ru/employers/25607?page=10
Т-Банк,Представитель банка,Москва,март 2026,Работал 1-2 года,4.3,"Быть частью команды Т-банка (громкое имя, с которым считаются)! График выполнения задач и отдыха! Поддержка непосредственного руководителя, наставника и коллег.",Оплату труда! Возможность возврата пакетов без выдачи в другой день. Также выдать представителям более удобные и вместительные рюкзаки для работы Ответ представителя компании Март 2026,"Быть частью команды Т-банка (громкое имя, с которым считаются)! График выполнения задач и отдыха! Поддержка непосредственного руководителя, наставника и коллег. Оплату труда! Возможность возврата пакетов без выдачи в другой день. Также выдать представителям более удобные и вместительные рюкзаки для работы Ответ представителя компании Март 2026",positive,https://dreamjob.ru/employers/25607?page=10
Т-Банк,Агент по продажам,Москва,март 2026,Работал 1-2 года,4.0,"С первого и до последнего дня работала на удаленке. Организация прекрасная кстати: продуманные процессы, простые взаимодействия с коллегами и с руководством, а также полное отсутствие бюрократии, хорошо работающий софт. По деньгам всегда устраивало.","Эмоционально трудно и еще труднее, когда долго впустую висишь на линии. Думаю, что можно улучшить качество базы для обзвона и тогда ожидание на линии сократится. Мне так кажется, не знаю насколько реально это сделать в действительности. Ответ представителя компании Март 2026","С первого и до последнего дня работала на удаленке. Организация прекрасная кстати: продуманные процессы, простые взаимодействия с коллегами и с руководством, а также полное отсутствие бюрократии, хорошо работающий софт. По деньгам всегда устраивало. Эмоционально трудно и еще труднее, когда долго впустую висишь на линии. Думаю, что можно улучшить качество базы для обзвона и тогда ожидание на линии сократится. Мне так кажется, не знаю насколько реально это сделать в действительности. Ответ представителя компании Март 2026",positive,https://dreamjob.ru/employers/25607?page=10
Т-Банк,Специалист по развитию бизнеса,Москва,март 2026,Работаю 1-2 года,5.0,"Рабочий график, хороший коллектив. Много бонусов для сотрудников. Дмс, карьерный рост","В принципе улучшать нечего, мне все нравится в этой компании) Хотелось бы иногда в офис выходить, что бы разбавить работу из дома, а так все супер! Ответ представителя компании Март 2026","Рабочий график, хороший коллектив. Много бонусов для сотрудников. Дмс, карьерный рост В принципе улучшать нечего, мне все нравится в этой компании) Хотелось бы иногда в офис выходить, что бы разбавить работу из дома, а так все супер! Ответ представителя компании Март 2026",positive,https://dreamjob.ru/employers/25607?page=10
Т-Банк,Оператор call-центра,Москва,март 2026,Работал 5-10 лет,4.7,"Лояльность к сотрудникам, френдли стиль в компании, возможность свободного графика","Коммуникация между отделами, не вся информация есть в базе. Более простая система мотивации Ответ представителя компании Март 2026","Лояльность к сотрудникам, френдли стиль в компании, возможность свободного графика Коммуникация между отделами, не вся информация есть в базе. Более простая система мотивации Ответ представителя компании Март 2026",positive,https://dreamjob.ru/employers/25607?page=10
Т-Банк,Банковский представитель,Пожаловаться Работаю меньше года Москва,март 2026,Работаю меньше года,1.0,"Берут абсолютно всех, возможность выбора рабочих дней, выдают всё необходимое для работы","Продажный ресурс Будьте готовы, что вы никакой не представитель банка, вы-самый обычный курьер, который будет развозить карты и симки. Поэтому берут на эту позицию абсолютно всех, без исключения. Теперь как есть, без купюр-зарабатывать вы будете меньше, чем курьеры в озоне или самокате. Штрафы не соразмерны вознаграждению-за доставку вам будут платить условно 100 руб, а за нарушение-вычитать несколько сотен, а может и тысяч. В итоге, потратив целый день в разъездах, за мелкое нарушение вы можете потерять весь дневной заработок. Не удивительно, что они постоянно ищут курьеров, так как желающих работать там становится всё меньше и меньше. Ответ представителя компании Апрель 2026","Берут абсолютно всех, возможность выбора рабочих дней, выдают всё необходимое для работы Продажный ресурс Будьте готовы, что вы никакой не представитель банка, вы-самый обычный курьер, который будет развозить карты и симки. Поэтому берут на эту позицию абсолютно всех, без исключения. Теперь как есть, без купюр-зарабатывать вы будете меньше, чем курьеры в озоне или самокате. Штрафы не соразмерны вознаграждению-за доставку вам будут платить условно 100 руб, а за нарушение-вычитать несколько сотен, а может и тысяч. В итоге, потратив целый день в разъездах, за мелкое нарушение вы можете потерять весь дневной заработок. Не удивительно, что они постоянно ищут курьеров, так как желающих работать там становится всё меньше и меньше. Ответ представителя компании Апрель 2026",negative,https://dreamjob.ru/employers/25607?page=10
Т-Банк,Специалист технической поддержки,Пожаловаться Работал меньше года Москва,март 2026,Работал меньше года,2.5,"Большой плюс работы на дому, но минусы что нет роста. Все равно все остается на линии, приема звонков.","Повысить заработную плату для сотрудников первой линии. Нагрузка вся на них,на сотрудников горячей линии. Ответ представителя компании Март 2026","Большой плюс работы на дому, но минусы что нет роста. Все равно все остается на линии, приема звонков. Повысить заработную плату для сотрудников первой линии. Нагрузка вся на них,на сотрудников горячей линии. Ответ представителя компании Март 2026",negative,https://dreamjob.ru/employers/25607?page=10
Т-Банк,Отзыв сотрудника,Пожаловаться Работаю меньше года Самара,март 2026,Работаю меньше года,5.0,"Удобный график, платят всегда вовремя. Обучение качественное, после него фактически готова была к работе и сразу начала работать без косяков. Зарплата неплохая, еще и нормальная премия, на которую можно влиять.","Не хватает живого общения с коллегами. Мне кажется, что даже при удаленке это во всех городах можно организовать. Ответ представителя компании Март 2026","Удобный график, платят всегда вовремя. Обучение качественное, после него фактически готова была к работе и сразу начала работать без косяков. Зарплата неплохая, еще и нормальная премия, на которую можно влиять. Не хватает живого общения с коллегами. Мне кажется, что даже при удаленке это во всех городах можно организовать. Ответ представителя компании Март 2026",positive,https://dreamjob.ru/employers/25607?page=10
Т-Банк,Руководитель отдела клиентского обслуживания,Москва,март 2026,Работал 1-2 года,4.5,"Коллектив, условия для работы, отношение руководства, внутренняя политика банка.","Заработная плата, обучение пр трудоустройстве, хотелось бы более обширного обучения на начальном этапе Ответ представителя компании Март 2026","Коллектив, условия для работы, отношение руководства, внутренняя политика банка. Заработная плата, обучение пр трудоустройстве, хотелось бы более обширного обучения на начальном этапе Ответ представителя компании Март 2026",positive,https://dreamjob.ru/employers/25607?page=10
Т-Банк,Ведущий оператор call-центра,Киров,март 2026,Работал 1-2 года,5.0,"Сразу оформили по ТК. Была ДМС уже через 3 месяца, через год по страховке добавили еще и льготную стоматологию. Коллектив нормальный. Правила адекватные. Дисциплина и порядок, как я в принципе и люблю.","Сделать сразу льготную стоматологию по ДМС можно, вот ее я помню очень ждала в первый год. Ответ представителя компании Март 2026","Сразу оформили по ТК. Была ДМС уже через 3 месяца, через год по страховке добавили еще и льготную стоматологию. Коллектив нормальный. Правила адекватные. Дисциплина и порядок, как я в принципе и люблю. Сделать сразу льготную стоматологию по ДМС можно, вот ее я помню очень ждала в первый год. Ответ представителя компании Март 2026",positive,https://dreamjob.ru/employers/25607?page=10
Т-Банк,Банковский представитель,Казань,март 2026,Работал 1-2 года,5.0,"Все было ок. Ушла потому что закончила заочку и пошла развиваться по профессии. А в Т-банке работала пока училась - за счет гибкого рабочего графика было удобно совмещать работу и учебу на заочном (не было проблем отпроситься на сессию, например). Зарабатывала больше, чем подруги официантки и продавцы. Ну и мне нравилось - что постоянно в движении, постоянно общение с новыми людьми.","Нужно быть уверенным в своем транспорте, разьездов очень много. Ответ представителя компании Март 2026","Все было ок. Ушла потому что закончила заочку и пошла развиваться по профессии. А в Т-банке работала пока училась - за счет гибкого рабочего графика было удобно совмещать работу и учебу на заочном (не было проблем отпроситься на сессию, например). Зарабатывала больше, чем подруги официантки и продавцы. Ну и мне нравилось - что постоянно в движении, постоянно общение с новыми людьми. Нужно быть уверенным в своем транспорте, разьездов очень много. Ответ представителя компании Март 2026",positive,https://dreamjob.ru/employers/25607?page=10
Т-Банк,Аналитик,Пожаловаться Работал меньше года Москва,март 2026,Работал меньше года,3.7,"Удаленно, график сам выбираешь. Дружный коллектив, помогают всегда. Обучение доступное и понятное.","Зарплату, оценку сотрудников и премии. Отношение к работникам одиноко воспитывающих детей. Ответ представителя компании Март 2026","Удаленно, график сам выбираешь. Дружный коллектив, помогают всегда. Обучение доступное и понятное. Зарплату, оценку сотрудников и премии. Отношение к работникам одиноко воспитывающих детей. Ответ представителя компании Март 2026",neutral,https://dreamjob.ru/employers/25607?page=10
Т-Банк,Менеджер по продажам B2B,Пожаловаться Работаю меньше года Москва,март 2026,Работаю меньше года,4.3,"Работа из дома, свободное планирование своего дня, реальный уровень хорошего дохода, на который ты легко влияешь",Убрать ежедневные ненужные встречи (на 15 минут) Больше доп. вознаграждений (по типу 13 зарплаты) Ответ представителя компании Март 2026,"Работа из дома, свободное планирование своего дня, реальный уровень хорошего дохода, на который ты легко влияешь Убрать ежедневные ненужные встречи (на 15 минут) Больше доп. вознаграждений (по типу 13 зарплаты) Ответ представителя компании Март 2026",positive,https://dreamjob.ru/employers/25607?page=10
Т-Банк,Руководитель группы операторов,Москва,март 2026,Работаю 3-5 лет,5.0,"Что можно работать удаленно, возможность роста в компании, возможность работать в разных сферах внутри одной компании, белая зп всегда вовремя, отпуски и много разных плюшек от работодателя","Я не знаю что можно улучшить, в компании всегда думают о сотрудниках, даже когда происходят серьезные изменения Ответ представителя компании Март 2026","Что можно работать удаленно, возможность роста в компании, возможность работать в разных сферах внутри одной компании, белая зп всегда вовремя, отпуски и много разных плюшек от работодателя Я не знаю что можно улучшить, в компании всегда думают о сотрудниках, даже когда происходят серьезные изменения Ответ представителя компании Март 2026",positive,https://dreamjob.ru/employers/25607?page=10
