company,position,city,review_date,experience,rating_total,pros_text,cons_text,full_text,sentiment_label,source_url
Т-Банк,Отзыв сотрудника,Пожаловаться Работал меньше года Москва,февраль 2026,Работал меньше года,5.0,"Рабочий график Работа не сложная , всему обучат и покажут, коллеги всегда помогут","Зарплата, условия труда, обеспечить некоторым группам лиц с низким уровнем доходов, гарнитурой и интернетом Ответ представителя компании Февраль 2026","Рабочий график Работа не сложная , всему обучат и покажут, коллеги всегда помогут Зарплата, условия труда, обеспечить некоторым группам лиц с низким уровнем доходов, гарнитурой и интернетом Ответ представителя компании Февраль 2026",positive,https://dreamjob.ru/employers/25607?page=15
Т-Банк,Представитель,Санкт-Петербург,февраль 2026,Работаю 1-2 года,4.5,"Очень ценится то, что сейчас, к сожалению, мало кто предлагает - свободный график и влияние на свое вознаграждение , которое сопровождается человеческими отношениями между обычными сотрудниками и кураторами и более высоким руководством.","Более лояльно выставлять нарушения: иногда замечал практику, как банк вставал на сторону клиента, при этом не поверив своему представителю, это грустно. Всё же, мы - лицо банка, люди, с которыми клиент взаимодействует очно , представители заслуживают большего доверия. С другой стороны, руководство тоже можно понять, бывают нарушения, которые по техническим причинам нельзя ни опровергнуть, ни подтвердить и безапелляционно утверждать, что сотрудник однозначно прав - невозможно Ответ представителя компании Февраль 2026","Очень ценится то, что сейчас, к сожалению, мало кто предлагает - свободный график и влияние на свое вознаграждение , которое сопровождается человеческими отношениями между обычными сотрудниками и кураторами и более высоким руководством. Более лояльно выставлять нарушения: иногда замечал практику, как банк вставал на сторону клиента, при этом не поверив своему представителю, это грустно. Всё же, мы - лицо банка, люди, с которыми клиент взаимодействует очно , представители заслуживают большего доверия. С другой стороны, руководство тоже можно понять, бывают нарушения, которые по техническим причинам нельзя ни опровергнуть, ни подтвердить и безапелляционно утверждать, что сотрудник однозначно прав - невозможно Ответ представителя компании Февраль 2026",positive,https://dreamjob.ru/employers/25607?page=15
Т-Банк,Представитель,Москва,февраль 2026,Работаю 3-5 лет,3.2,свобода выбора графика и возможность смены регниона оказания услуг,Не снижать уровень оплаты и не увеличивать спектр обязанностей Ответ представителя компании Февраль 2026,свобода выбора графика и возможность смены регниона оказания услуг Не снижать уровень оплаты и не увеличивать спектр обязанностей Ответ представителя компании Февраль 2026,neutral,https://dreamjob.ru/employers/25607?page=15
Т-Банк,Агент по продажам,Нижний Новгород,февраль 2026,Работаю 1-2 года,5.0,"Я работала в продажах. Пришла с нулевыми знаниями, всему научилась здесь. Обучение быстрое, но информации очень много и далее тоже была поддержка, так что прокачала классно скиллы продаж. Это и помогало нормально зарабатывать.","Давать больше времени на обучение, так как нужно очень много информации за раз усвоить. Ответ представителя компании Февраль 2026","Я работала в продажах. Пришла с нулевыми знаниями, всему научилась здесь. Обучение быстрое, но информации очень много и далее тоже была поддержка, так что прокачала классно скиллы продаж. Это и помогало нормально зарабатывать. Давать больше времени на обучение, так как нужно очень много информации за раз усвоить. Ответ представителя компании Февраль 2026",positive,https://dreamjob.ru/employers/25607?page=15
Т-Банк,Ведущий консультант,Москва,февраль 2026,Работаю 3-5 лет,5.0,"Работал в Инвестициях. Колоссальный опыт для меня. Именно в плане работы с клиентами брокеров, далее планирую развиваться в той же сфере, но уже углубляясь в сами инвестиции. Учился в соответствующем направлении на заочке. Получалось совмещать работу и учебу. График был удобный, работал 2/2. Если нужно было очень, то шли навстречу, разрешали поменяться сменами. Был ДМС и все льготы, оформление официальное. По зарплате устраивало, также выходила неплохая премия - ее начисляли по результатам, но с ними у меня никогда проблем не было.","Как вариант улучшить медстраховку, предоставлять стоматологию через 3 месяца как и сам полис, а не через год, как я получил в свое время. Ответ представителя компании Февраль 2026","Работал в Инвестициях. Колоссальный опыт для меня. Именно в плане работы с клиентами брокеров, далее планирую развиваться в той же сфере, но уже углубляясь в сами инвестиции. Учился в соответствующем направлении на заочке. Получалось совмещать работу и учебу. График был удобный, работал 2/2. Если нужно было очень, то шли навстречу, разрешали поменяться сменами. Был ДМС и все льготы, оформление официальное. По зарплате устраивало, также выходила неплохая премия - ее начисляли по результатам, но с ними у меня никогда проблем не было. Как вариант улучшить медстраховку, предоставлять стоматологию через 3 месяца как и сам полис, а не через год, как я получил в свое время. Ответ представителя компании Февраль 2026",positive,https://dreamjob.ru/employers/25607?page=15
Т-Банк,Отзыв сотрудника,Череповец,февраль 2026,Работаю 1-2 года,3.7,"Нравится график работы, приятно когда учитывают твои пожелания к выходным, но конечно же это не всегда.","Хотелось бы улучшить уровень дохода. Понимаю, что все зависит от региона, но все же. Ответ представителя компании Февраль 2026","Нравится график работы, приятно когда учитывают твои пожелания к выходным, но конечно же это не всегда. Хотелось бы улучшить уровень дохода. Понимаю, что все зависит от региона, но все же. Ответ представителя компании Февраль 2026",neutral,https://dreamjob.ru/employers/25607?page=15
Т-Банк,Ведущий менеджер по продажам,Краснодар,февраль 2026,Работаю 1-2 года,5.0,"По графику я сама выбираю, когда работаю. Это согласовывается заранее, но у меня с планированием проблем не бывает, поэтому тут все ок. Работаю в удобном для себя режиме. Зарабатываю больше и больше от месяца к месяцу. Все нормально сейчас и по деньгам, и по удобству. Сложно придраться даже при желании.","Мне на самом деле все нравится за исключением того, что не хватает корпоративов. У нас в городе, по крайней мере, ничего такого не устраивают. Ответ представителя компании Февраль 2026","По графику я сама выбираю, когда работаю. Это согласовывается заранее, но у меня с планированием проблем не бывает, поэтому тут все ок. Работаю в удобном для себя режиме. Зарабатываю больше и больше от месяца к месяцу. Все нормально сейчас и по деньгам, и по удобству. Сложно придраться даже при желании. Мне на самом деле все нравится за исключением того, что не хватает корпоративов. У нас в городе, по крайней мере, ничего такого не устраивают. Ответ представителя компании Февраль 2026",positive,https://dreamjob.ru/employers/25607?page=15
Т-Банк,Специалист по документообороту,Москва,февраль 2026,Работаю 1-2 года,5.0,"ЗП нормальная. Для такой простой работы так точно. Отношение хорошее. Офис близко к дому, для меня это тоже важный фактор при выборе работы был. Быстро устроиться получилось, быстро начала нормально зарабатывать.","Проблем особых не было в работе. Разве что рутина. Если с этим что-то можно сделать, то сделайте) Ответ представителя компании Февраль 2026","ЗП нормальная. Для такой простой работы так точно. Отношение хорошее. Офис близко к дому, для меня это тоже важный фактор при выборе работы был. Быстро устроиться получилось, быстро начала нормально зарабатывать. Проблем особых не было в работе. Разве что рутина. Если с этим что-то можно сделать, то сделайте) Ответ представителя компании Февраль 2026",positive,https://dreamjob.ru/employers/25607?page=15
Т-Банк,Ведущий оператор клиентской поддержки,Москва,февраль 2026,Работаю 5-10 лет,5.0,"Быстро получилось устроиться. Обучение 2 недели, даже меньше было. Потом работал с наставником еще. Помогло сразу комфортно себя на линии чувствовать и в общении с клиентами ошибок не допускать. Соответственно сразу нормальная зарплата. Вскоре ДМС дали. Больше 6 лет проработал в сумме. По деньгам устраивало, плюс бонусов много было, которых сейчас вот как раз не хватает.","Полностью учитывать пожелания сотрудников по выбранным сменам. Быстрее переводить в чаты, я год почти ждал, пока переведут. Ответ представителя компании Февраль 2026","Быстро получилось устроиться. Обучение 2 недели, даже меньше было. Потом работал с наставником еще. Помогло сразу комфортно себя на линии чувствовать и в общении с клиентами ошибок не допускать. Соответственно сразу нормальная зарплата. Вскоре ДМС дали. Больше 6 лет проработал в сумме. По деньгам устраивало, плюс бонусов много было, которых сейчас вот как раз не хватает. Полностью учитывать пожелания сотрудников по выбранным сменам. Быстрее переводить в чаты, я год почти ждал, пока переведут. Ответ представителя компании Февраль 2026",positive,https://dreamjob.ru/employers/25607?page=15
Т-Банк,Оператор контактного центра,Тверь,февраль 2026,Работал 1-2 года,4.0,"Сразу оформление по ТК. Не сразу, но вскоре перешел на желаемые 2-2 и ночные смены. По зарплате меня всегда все устраивало. С коллегами никаких разногласий не было, с руководителем тоже. Нормально работал, клиенты даже преимущественно адекватные были.","Не сразу желаемый посменный график 2-2 и работа в ночь. Мотивировали тем, что должен быть на связи высококлассный специалист, который может помочь, пока учусь. Хотя все было понятно, можно было и сразу в желаемый график меня вписать. Ответ представителя компании Февраль 2026","Сразу оформление по ТК. Не сразу, но вскоре перешел на желаемые 2-2 и ночные смены. По зарплате меня всегда все устраивало. С коллегами никаких разногласий не было, с руководителем тоже. Нормально работал, клиенты даже преимущественно адекватные были. Не сразу желаемый посменный график 2-2 и работа в ночь. Мотивировали тем, что должен быть на связи высококлассный специалист, который может помочь, пока учусь. Хотя все было понятно, можно было и сразу в желаемый график меня вписать. Ответ представителя компании Февраль 2026",positive,https://dreamjob.ru/employers/25607?page=15
Т-Банк,Представитель,Пожаловаться Работал меньше года Екатеринбург,февраль 2026,Работал меньше года,2.2,"Свобода выбора рабочих смен раз в неделю, но если выбрать свой интервал то платят меньше","Робот который ставит незапланированые встречи в течении дня, ты можешь быть в одном конце города, а он тебя отправляет в другой конец, если не едешь или отмеряешь тебе штраф, если клиент говорит, что не может и просит отменить встречу, всё равно штраф Ответ представителя компании Февраль 2026","Свобода выбора рабочих смен раз в неделю, но если выбрать свой интервал то платят меньше Робот который ставит незапланированые встречи в течении дня, ты можешь быть в одном конце города, а он тебя отправляет в другой конец, если не едешь или отмеряешь тебе штраф, если клиент говорит, что не может и просит отменить встречу, всё равно штраф Ответ представителя компании Февраль 2026",negative,https://dreamjob.ru/employers/25607?page=15
Т-Банк,Специалист отдела страхования,Москва,февраль 2026,Работал 1-2 года,5.0,"Работала в Т-банке специалистом в отделе страхования, живой коллектив, умные люди, много интересного. Рекомендую!","За время работы все устраивало, даже и не знаю, что можно улучшить. Все прекрасно: коллектив, отношение, з/п. Ответ представителя компании Февраль 2026","Работала в Т-банке специалистом в отделе страхования, живой коллектив, умные люди, много интересного. Рекомендую! За время работы все устраивало, даже и не знаю, что можно улучшить. Все прекрасно: коллектив, отношение, з/п. Ответ представителя компании Февраль 2026",positive,https://dreamjob.ru/employers/25607?page=15
Т-Банк,Региональный менеджер по развитию партнерской сети,Москва,февраль 2026,Работал 3-5 лет,2.3,Все оформление на честном слове. При постоянной работе оформление по договору ГПХ. При этом невозможно получить подписанный договор на руки.,Объяснить руководству правила оформления договорных отношений с наемными сотрудниками. Ответ представителя компании Февраль 2026,Все оформление на честном слове. При постоянной работе оформление по договору ГПХ. При этом невозможно получить подписанный договор на руки. Объяснить руководству правила оформления договорных отношений с наемными сотрудниками. Ответ представителя компании Февраль 2026,negative,https://dreamjob.ru/employers/25607?page=15
Т-Банк,Специалист контактного центра,Москва,февраль 2026,Работал 3-5 лет,5.0,"Нравилась корпоративная политика в отношении клиентов. Именно разумная. Никакого давления по сути не было. Только логичные, адекватные требования почти всегда. Нравился график, как платили и как относились.","Нужно более гибко подходить к тому же началу рабочего дня, к небольшим опозданиям относиться лояльнее. Мое мнение -слишком строгая дисциплина. Ответ представителя компании Февраль 2026","Нравилась корпоративная политика в отношении клиентов. Именно разумная. Никакого давления по сути не было. Только логичные, адекватные требования почти всегда. Нравился график, как платили и как относились. Нужно более гибко подходить к тому же началу рабочего дня, к небольшим опозданиям относиться лояльнее. Мое мнение -слишком строгая дисциплина. Ответ представителя компании Февраль 2026",positive,https://dreamjob.ru/employers/25607?page=15
Т-Банк,Системный аналитик,Пожаловаться Работаю меньше года Санкт-Петербург,февраль 2026,Работаю меньше года,4.7,"Кайф условия, кайф офис, но туда никто не гонит. Интересно работать, есть ротация, если стало скучно","Доход бы чуть выше, а также более прозрачные/понятные процессы роста Ответ представителя компании Февраль 2026","Кайф условия, кайф офис, но туда никто не гонит. Интересно работать, есть ротация, если стало скучно Доход бы чуть выше, а также более прозрачные/понятные процессы роста Ответ представителя компании Февраль 2026",positive,https://dreamjob.ru/employers/25607?page=15
